{
  "generated_at": "2026-10-29T10:25:00+01:00",
  "date": "2026-10-29",
  "status": "ok",
  "window_hours": 24,
  "summary": "The big mainstream story was Pokémon Center cancelling Delta Reign pre-orders. It targeted bots, but many normal buyers got cancelled too, and they are angry. Trust in graded cards also took a hit: a record $288K PSA 10 Dragonite is facing fake-slab claims, and PSA reopened its Value tier at $39.99 with a 90–100 business day wait. On-chain, rivals pushed pull-clip content hard: Beezie pack battles, Jupiter Gacha memes and a Troll token pack giveaway, and bye.fun live rips with Solana Gaming. Solflare Packs talk was steady and positive, but still mostly small ambassador-style explainer posts.",
  "top_posts": [
    {
      "url": "https://x.com/PokeTCGAlerts/status/2115565709035974680",
      "author_handle": "@PokeTCGAlerts",
      "text": "Pokémon Center is starting to cancel pre-orders for Delta Reign 🚨 While many appear to be botted orders, I'm also seeing a lot of manual users reporting cancellations. Make sure to check your emails...",
      "created_at": "2026-10-28T22:05:45Z",
      "likes": 202,
      "reposts": 7,
      "replies": 40,
      "quotes": 3,
      "topic": "pain point / sold-out retail",
      "why_it_matters": "55k impressions. Real collectors lost orders they waited hours for. Packs you can open any time, with no queue, speak to this."
    },
    {
      "url": "https://x.com/PokePirateAsh/status/2115550028332736905",
      "author_handle": "@PokePirateAsh",
      "text": "Pokemon Center is starting to cancel botted orders for Delta Reign! Just like with 30th Anniversary it seems that they're making improvements in catching botted orders. I hope we get another que for Delta Reign.",
      "created_at": "2026-10-28T21:03:26Z",
      "likes": 39,
      "reposts": 4,
      "replies": 18,
      "quotes": 1,
      "topic": "pain point / scalpers",
      "why_it_matters": "6.5k impressions. Bots and scalpers are the main retail complaint this week."
    },
    {
      "url": "https://x.com/lilybrodi/status/2115607442314985829",
      "author_handle": "@lilybrodi",
      "text": "i did a pack battle and pulled a $2423 card on beezie 🥹",
      "created_at": "2026-10-29T00:51:34Z",
      "likes": 65,
      "reposts": 5,
      "replies": 15,
      "quotes": 0,
      "topic": "competitor / pack opening",
      "why_it_matters": "2.5k impressions. Beezie uses creator pull clips and a 'pack battle' format. Their brand account reposts every pull."
    },
    {
      "url": "https://x.com/solanagaming/status/2115461114507198792",
      "author_handle": "@solanagaming",
      "text": "Live with @thebyefun Ripping packs and exploring the first community-owned gacha on Solana. Let's roll 👇",
      "created_at": "2026-10-28T15:10:07Z",
      "likes": 61,
      "reposts": 5,
      "replies": 27,
      "quotes": 1,
      "topic": "competitor / live rips",
      "why_it_matters": "4.3k impressions. A big Solana account hosting a live rip for a new rival. Live rips with bigger hosts are a format we could try."
    },
    {
      "url": "https://x.com/jupiter_trade/status/2115727743274901629",
      "author_handle": "@jupiter_trade",
      "text": "POV: Me after my Gacha pack animation shows \"1999\", \"PSA 10\", \"Common\"",
      "created_at": "2026-10-29T08:49:36Z",
      "likes": 11,
      "reposts": 1,
      "replies": 8,
      "quotes": 1,
      "topic": "competitor / meme format",
      "why_it_matters": "Jupiter is posting relatable reveal-moment memes for Gacha. Light, no-launch format we could do in our own voice."
    },
    {
      "url": "https://x.com/Omo_iyaalabi/status/2115509118748492241",
      "author_handle": "@Omo_iyaalabi",
      "text": "Day 5 of my @solflare Enlightenment Journey. We've officially reached the final chapter of this Enlightenment series. Quick recap • Day 1: We explored how Solflare Packs came to life through the partnership with Collector Crypt...",
      "created_at": "2026-10-28T18:20:52Z",
      "likes": 37,
      "reposts": 13,
      "replies": 13,
      "quotes": 0,
      "topic": "Solflare Packs",
      "why_it_matters": "Top Solflare Packs post of the day. A 5-day explainer series; ambassador-style."
    },
    {
      "url": "https://x.com/khing_ladipoe/status/2115489718087581977",
      "author_handle": "@khing_ladipoe",
      "text": "with @solflare, you can rip packs straight from your wallet, uncover physical trading cards, and own your collectibles on-chain without worrying about where to store them...",
      "created_at": "2026-10-28T17:03:47Z",
      "likes": 26,
      "reposts": 3,
      "replies": 25,
      "quotes": 0,
      "topic": "Solflare Packs",
      "why_it_matters": "Most viewed Solflare Packs post today (1.3k impressions). Storage and vaulting is the angle that landed."
    },
    {
      "url": "https://x.com/BlackhawkTim/status/2115501825210110272",
      "author_handle": "@BlackhawkTim",
      "text": "Will be moving my sub $500 TCG grading shenanigans to CGC from @PSAcard. $40 is insane. Just submit a bunch of Pokemon for $17/ea.",
      "created_at": "2026-10-28T17:51:53Z",
      "likes": 0,
      "reposts": 0,
      "replies": 0,
      "quotes": 0,
      "topic": "pain point / grading cost",
      "why_it_matters": "Grading cost and wait are a live complaint as PSA Value returns at $39.99. Our pulls arrive already graded."
    },
    {
      "url": "https://x.com/bottleofdonut/status/2115547641119420762",
      "author_handle": "@bottleofdonut",
      "text": "fake PSA, stolen graded cards, stickers on cards, weighted packs… SCAM SCAM SCAM SCAM!! PIVOT TO DIGITAL TRADING CARDS...",
      "created_at": "2026-10-28T20:53:57Z",
      "likes": 11,
      "reposts": 2,
      "replies": 3,
      "quotes": 0,
      "topic": "pain point / fakes",
      "why_it_matters": "Fakes and weighted packs come up again. Vaulted, authenticated cards answer this, but keep it calm, not fear-based."
    }
  ],
  "competitor_news": [
    {
      "project": "Beezie",
      "headline": "Beezie pushes 'pack battles' and claw-machine pulls with creators like @lilybrodi; the brand reposts user pulls all night",
      "url": "https://x.com/lilybrodi/status/2115607442314985829",
      "date": "2026-10-29"
    },
    {
      "project": "Jupiter Gacha",
      "headline": "Troll token gives away 102 'Troll Lolol Packs' of Pokémon cards to top holders, claimed on Jupiter Gacha (283 likes, 7.9k impressions)",
      "url": "https://x.com/Troll_/status/2115485014007881768",
      "date": "2026-10-28"
    },
    {
      "project": "Jupiter Gacha",
      "headline": "Jupiter posts a reveal-moment meme for Gacha; a critic calls the $50 Gacha pack 'predatory gambling mechanics'",
      "url": "https://x.com/jupiter_trade/status/2115727743274901629",
      "date": "2026-10-29"
    },
    {
      "project": "bye.fun",
      "headline": "Solana Gaming hosts a live pack rip with bye.fun, billed as the first community-owned gacha on Solana",
      "url": "https://x.com/solanagaming/status/2115461114507198792",
      "date": "2026-10-28"
    },
    {
      "project": "Collector Crypt / Phygitals",
      "headline": "Users say Pump.fun packs moved from Collector Crypt ($CARDS) to Phygitals; reaction is mixed and unconfirmed by either company",
      "url": "https://x.com/mate__puachista/status/2115421481438151036",
      "date": "2026-10-28"
    },
    {
      "project": "Courtyard",
      "headline": "Third-party post says Courtyard did $13.8M in sales over 7 days, more than every other NFT collection combined",
      "url": "https://x.com/cydelmg/status/2115437300318638356",
      "date": "2026-10-28"
    },
    {
      "project": "Fanatics Collect / PSA",
      "headline": "Record $288K PSA 10 Dragonite sold on Fanatics Collect faces forgery claims; Fanatics is reviewing (X news summary)",
      "url": "https://x.com/i/trending/2115531679724896708",
      "date": "2026-10-28"
    }
  ],
  "solflare_mentions": [
    {
      "url": "https://x.com/Omo_iyaalabi/status/2115509118748492241",
      "author_handle": "@Omo_iyaalabi",
      "text": "Day 5 of my @solflare Enlightenment Journey... how Solflare Packs came to life through the partnership with Collector Crypt...",
      "sentiment": "positive",
      "likes": 37
    },
    {
      "url": "https://x.com/khing_ladipoe/status/2115489718087581977",
      "author_handle": "@khing_ladipoe",
      "text": "with @solflare, you can rip packs straight from your wallet, uncover physical trading cards, and own your collectibles on-chain without worrying about where to store them.",
      "sentiment": "positive",
      "likes": 26
    },
    {
      "url": "https://x.com/0x_invisible/status/2115690963444158725",
      "author_handle": "@0x_invisible",
      "text": "I finally got to open a @solflare Pack. If you're new to Packs, here's how it works: You can open a Pack using USDC, or a friend can gift one to you.",
      "sentiment": "positive",
      "likes": 17
    },
    {
      "url": "https://x.com/Xiznft/status/2115543226564350443",
      "author_handle": "@Xiznft",
      "text": "New Rip pack on my @solflare wallet. Zekrom pulled here is a common but look so epic tbh. Keep manifesting a Epic soon 😍",
      "sentiment": "positive",
      "likes": 12
    },
    {
      "url": "https://x.com/Amon_006/status/2115702638930993652",
      "author_handle": "@Amon_006",
      "text": "Opening a real Pokemon cards directly inside Solana wallet. No, this isn't a game, Solflare launched Packs. Powered by @Collector_Crypt...",
      "sentiment": "positive",
      "likes": 6
    },
    {
      "url": "https://x.com/soonmource/status/2115710613187862993",
      "author_handle": "@soonmource",
      "text": "Pokemon packs inside a wallet is wild lol",
      "sentiment": "neutral",
      "likes": 1
    },
    {
      "url": "https://x.com/HITZ_tcg/status/2115392012426121412",
      "author_handle": "@HITZ_tcg",